{
  "$schema": "https://json-schema.org/draft/2020-12/schema",
  "$id": "urn:tabellio:schema:platform:v0.1",
  "title": "Tabellio Platform Configuration",
  "type": "object",
  "additionalProperties": false,
  "required": ["schemaVersion", "canonicalForge", "git", "ledger", "validation", "reviews", "transition"],
  "properties": {
    "schemaVersion": { "const": "tabellio-platform/v0.1" },
    "canonicalForge": {
      "type": "object",
      "additionalProperties": false,
      "required": ["provider", "urlEnv", "apiUrlEnv", "tokenFileEnv"],
      "properties": {
        "provider": { "const": "forgejo" },
        "urlEnv": { "const": "TABELLIO_FORGE_URL" },
        "apiUrlEnv": { "const": "TABELLIO_FORGE_API_URL" },
        "tokenFileEnv": { "const": "TABELLIO_FORGE_TOKEN_FILE" }
      }
    },
    "git": {
      "type": "object",
      "additionalProperties": false,
      "required": ["stackManager", "codeRef", "controlRefs"],
      "properties": {
        "stackManager": { "const": "git-spice" },
        "codeRef": { "const": "refs/heads/main" },
        "controlRefs": {
          "type": "array",
          "minItems": 3,
          "uniqueItems": true,
          "items": { "enum": ["refs/tabellio/reviews", "refs/tabellio/validations", "refs/heads/entire/checkpoints/v1"] },
          "allOf": [
            { "contains": { "const": "refs/tabellio/reviews" } },
            { "contains": { "const": "refs/tabellio/validations" } },
            { "contains": { "const": "refs/heads/entire/checkpoints/v1" } }
          ]
        }
      }
    },
    "ledger": {
      "type": "object",
      "additionalProperties": false,
      "required": ["provider", "checkpointRef"],
      "properties": {
        "provider": { "const": "entire" },
        "checkpointRef": { "const": "refs/heads/entire/checkpoints/v1" }
      }
    },
    "validation": {
      "type": "object",
      "additionalProperties": false,
      "required": ["runner", "manifest", "resultRef"],
      "properties": {
        "runner": { "const": "tabellio-validate" },
        "manifest": { "type": "string", "minLength": 1 },
        "resultRef": { "const": "refs/tabellio/validations" }
      }
    },
    "reviews": {
      "type": "object",
      "additionalProperties": false,
      "required": ["provider", "stateRef"],
      "properties": {
        "provider": { "const": "forgejo" },
        "stateRef": { "const": "refs/tabellio/reviews" }
      }
    },
    "transition": {
      "type": "object",
      "additionalProperties": false,
      "required": ["codeStorage", "runtimeRequired"],
      "properties": {
        "codeStorage": { "type": "string", "minLength": 1 },
        "runtimeRequired": { "const": false }
      }
    }
  }
}
